{
  "metadataVersions": {
    "DataCite": {
      "version": "4.6",
      "url": "https://datacite-metadata-schema.readthedocs.io/en/4.6/"
    },
    "DCAT-AP-CH": {
      "version": "2.0",
      "url": "https://dcat-ap.ch/releases/2.0/dcat-ap-ch.html"
    }
  },
  "identifier": {
    "property": "identifier",
    "transform": "DataCitev4d6ToDCATv2"
  },
  "titles": {
    "property": "title",
    "transform": "DataCitev4d6ToDCATv2 extract first title"
  },
  "publisher": {
    "property": "publisher",
    "transform": "DataCitev4d6ToDCATv2"
  },
  "contributors": {
    "property": "contactPoint",
    "transform": "DataCitev4d6ToDCATv2"
  },
  "descriptions": {
    "property": "description",
    "transform": "DataCitev4d6ToDCATv2 extract first title"
  }
}